id,neighborhood,neighborhood_overview
10749312,Jamaica Plain,"Jamaica Plain is full of boutiques, restaurants and cafes with a hip, funky vibe. Family oriented and with a Latino flavor, JP has many green spaces including Jamaica Pond and the Arnold Arboretum for wonderful walks or bike rides. The house is located three minutes from the closest subway stop, the Orange Line, which will take you to the heart of Back Bay in 10 minutes. At the end of our little road you can see the 2nd tallest building in Boston, the Prudential Tower, but on our street it feels like New Hampshire! Around the corner is City Feed for morning coffee and locally sourced groceries, there is a beer/wine shop nearby, walk to popular Ula's Cafe in the morning or Bella Luna for brunch or dinner. Chilacates for fantastic burritos/tacos. And of course the Sam Adams Brewery is just across the train tracks - go for a tour, stay for a beer!"
14071446,Jamaica Plain,
6053700,Jamaica Plain,"Great restaurants, shopping, libraries, organic markets, GREAT arboretum for long walks, jamaica pond, 1.5 miles from longed medical area(feat hospitals."
1222327,Jamaica Plain,
6291807,Jamaica Plain,"EXTREMELY safe and 2-min walking distance to Forest Hills Orange Line T-Stop. Awesome restaurants, bars, and an organic grocery store at the end of the street. VERY easy to get anywhere in Boston (All universities, 15-minute T-ride to downtown Boston). It is also walking distance to the Franklin Park Zoo and Sam Adams Brewery. Great places to walk and run (Aboretum, Forest Hills Cemetery, and Jamaica Pond)"
9712731,Jamaica Plain,"JP has so much to offer! It is a 20 minute train or bus ride into the middle of the city. The apartment is walking distance from the Green and Orange lines, and the #39 bus stops right outside the building. Check out my guidebook for more of my recommendations that are all within walking distance! luscious green space & parks: JP is famous for it's close distance to the city while also seeming immersed in nature. Olmstead Park - at the end the street. There are baseball fields, walking trails, and pond Jamaica Pond - connects to Olmstead Park. large pond/reservoir with many walking trails, sailing, boat rental, soccer fields, beautiful hills, and walking trails."
8272350,Jamaica Plain,"Jamaica Plain (JP) has a funky, fun, eclectic mix of students, musicians, artists, professionals, and families. It is multi-cultural and progressive in nature. Our neighborhood is closely knit and filled with interesting people. Our green spaces..Jog around Jamaica pond, stroll through the Arboretum or the Emerald Necklace parks.  We are 10 minute walk to the Sam Adams Brewery which offers free tours (and free beer with it)."
14254537,Jamaica Plain,
799701,Jamaica Plain,"What I love about my neighborhood is the green space, the restaurants, and the people."
9591772,Jamaica Plain,
14474114,Jamaica Plain,
9865550,Jamaica Plain,"JP is one of the best neighborhoods in Boston, tons of great cafés, restaurants & shops within walking distance, plus an abundance of green space – our building sits on the Southwest Corridor Park (only a 15min bike-ride downtown)."
12274601,Jamaica Plain,
11159585,Jamaica Plain,
5212321,Jamaica Plain,Jamaica plain is one of the most highly sought after neighborhoods in all of Boston IF you like diversity and friendliness along with a cool family vibe touched with artsy bits and nature. Wholefoods is up the street&the coolest little market with the best coffee and caps is 1 blk away.   Great food and bakeries along with a Brewery to tour.   Incredible Green ways like the Arnold Arboretum with trees from all over the world in a natural setting that will take your breath away ...deer and fox and coyotes live right there this close to downtown Boston. The Jamaica Pond is about 3 blks from here...you can rent boats and sail or row in spring and summer.
10074653,Jamaica Plain,"Jamaica Plain is a diverse Boston neighborhood: The Americas' Ave/Centre St (at the end of my street) is lined with restaurants serving food that reflects this diversity. Lovely outdoor areas: Walk/run around Jamaica Pond, The Harvard University Arnold Arboretum is beautiful in the spring and summer, cross-country skiing in winter.  The MFA and Gardner Museum are a short trolley ride. The Boston Freedom Trail and ICA are a short subway ride."
14683493,Jamaica Plain,
14682931,Jamaica Plain,
1628130,Jamaica Plain,"We love our home and community. It's a great, cozy house on a quiet street in a historic area across from a park and a 1-minute walk from the neighborhood's main street where there are lots of good restaurants, cute shops, a good wine store, two small grocery stores, great playgrounds for kids, etc.  Across the street from our house is the Eliot School, the 4th oldest educational institution in the US, and on Eliot Street you'll also find the Footlight Theater, ""America's oldest community theater."" And for just a bit more history check out the Loring-Greenough house, at the end of Eliot St., which George Washington and General Nathanael Greene visited in the 1700s, and where every Thursday eve in the summer you'll find food trucks, fun bands and scores of local families.  We're also a 5-minute walk from the Arnold Arboretum and Jamaica Pond - great for running, walks, renting sailboats and rowboats, fishing, and part of the Emerald Necklace along which one can bike to get to the Longwo"
6693305,Jamaica Plain,
6921672,Jamaica Plain,
12022134,Jamaica Plain,"We're situated right between the Arboretum, Jamaica Pond, and the best food and shopping JP has to offer! It's an exceptionally clean and safe neighborhood--I've never felt unsafe, even walking alone at night. The Sam Adams Brewery is ~1 mile away and is a must-see while you're here! There are many options for groceries, including Whole Foods (1 mile away, easily accessible by bus), Stop & Shop (1.4 miles, also easy to get to via bus, a brand new Wegmans (10 minute drive), and a weekly farmers' market one block away. We're less than a block from a YMCA-like community center if you're looking for somewhere affordable to work out. There's also a Boston Public Library branch next to that, but it's currently closed for renovations and I'm not sure when it's set to re-open. For any dog owners, we're 1 mile away from the Beecher Street Dog Park (off-leash, fully enclosed). We're also a block away from Polkadog Bakery if you're looking to spoil your furry friend with some delicious gourmet tr"
1929406,Jamaica Plain,"Jamaica Plain is a fantastic, family-friendly Boston neighborhood just southwest of the city center.  It's a semi-urban, funky area with lots of parks, restaurants, cafe's and shopping.  Our home is central to everything - a block from Centre Street (a dozen restaurants, JP Licks, City Feed & Supply, 39 bus stop), 2 blocks from the Orange Line, 4 blocks from Jamaica Pond."
9349646,Jamaica Plain,"This is a great home base for any trip to Boston.  Jamaica Plain is convenient to all of Boston's cultural & educational (medical, historical, etc) institutions, and also a pretty interesting place in its own right.   We're in a very friendly residential neighborhood full of parks, community gardens and quirky old houses.  And we're not far from restaurants, coffee shops, bars, and breweries."
13363171,Jamaica Plain,
9137560,Jamaica Plain,Close to center street where all the fun shops and restaurants are. We live right across the Aboretum Park.
2875267,Jamaica Plain,"There's so much to love about Jamaica Plain--we wouldn't want to live anywhere else! Below are some of our neighborhood favorites, and we are always willing to make additional recommendations!  OUTDOORS: JP boasts more green space than any other neighborhood in Boston, and it's well worth exploring. Take a stroll through Arnold Arboretum, a gorgeous living tree museum, or head over to Jamaica Pond where you can rent a boat, or join the joggers circling the perimeter.  FOOD AND DRINK:  For groceries, head to the local Whole Foods. City Feed and Supply offers great sandwiches, high-end groceries and good coffee. Next door at the Purple Cactus, you'll find quick and healthy-ish burritos and salads.On the other side of Centre Street, Bukhara is a good bet for Indian food. Petite neighborhood favorite Vee Vee offers creative American fare with vegetarian and vegan options, and brunch on Sundays. Ten Tables is another much-loved dinner spot, though booking ahead is a must as it only has--you"
2295530,Jamaica Plain,Jamaica Plain is a great place to live. The people are what make it wonderful.  It's as if you have the best of a small town and the benefits of a big city. The architecture is also a large component to the whole J.P. scene.
2378421,Jamaica Plain,JP is a diverse and artistic Boston neighborhood -  great little places to eat and get coffee; the BEST outdoor spaces with Jamaica Pond and the Arboretum as well as museums minutes away and downtown Boston a short subway or bus ride away.
7287822,Jamaica Plain,"Jamaica Plain is one of the most fun and funky neighborhoods of Boston. There are many restaurants, bars, galleries, and other entertainment options. JP is very gay-friendly.  We are also spoiled for green space - Jamaica Pond is within easy walking distance, and the Emerald Necklace string of parks links Jamaica Pond with the Charles River, with a lovely bike path running the whole way to the river.  We also have both the Arnold Arboretum (265 acres) and Franklin Park (zoo, golf course, trails, etc.) which are within easy distance as is the home of the Boston Beer Company, brewers of the famous Sam Adams beer."
4262255,Jamaica Plain,"Downtown Jamaica Plain is a delight with plenty of excellent restaurants and unusual stores.  The Arboretum, Franklin Park, or Forest Hills cemetery are a must if you enjoy a  good walk or bird watching."
4586681,Jamaica Plain,"Jamaica Plain is a youthful, trendy neighborhood with lots of great dining, shopping, and beautiful green space.  Green Street Station, on the orange line, is a 15-minute ride to downtown Boston.  Bus service gets you to Back Bay in 15 minutes."
197727,Jamaica Plain,"diverse, friendly ,convenient, sought after neighborhood among both young and old due to proximity to downtown, hospitals , universities and outdoor space.  convenient to transportation and bike bath"
6990904,Jamaica Plain,"We live in a spacious single family home in a family oriented neighborhood five minutes walk to the Brewery in JP (with a large gym, Bella Luna restaurant, Ula Cafe, and Sam Adams tours along with Mama and Me a great resource for families with young kids). We are a five minutes walk to the T (subway), with several playgrounds, the Southwest Corridor, Franklin Park Zoo, and local Dominican restaurants in close proximity. We have several excellent coffee shops great for picking up yummy breakfasts within a 10 minute walk (Canto 6, Café Ula, Cityfeed and Supply, and La Rana Rossa) as well as the new Chilcates mexican restaurant, and we are a 15-20 min walk from JP center and Hyde Square where you can find a variety of food from Thai to Indian, to high end cuisine.  Together with neighbors we helped start the Egleston Community Orchard around the corner from our home which hosts several annual festivals, outdoor movies in the summer, and is an open space to play in and pick fruit."
4181530,Jamaica Plain,"We love everything about our neighborhood! You can see from the map that you're walking distance to just about everything you could need. Our street is quiet and our neighbors are friendly. We all have each other's backs, which is a rarity for a city in the 21st century!"
4405982,Jamaica Plain,"Many universities located nearby, such as Boston College, Boston University, Northeastern University, Simmons and more. All are within 15 minutes of driving.  Also, for nature-lovers, we are located a 5 minute drive away from Harvard University’s Arnold Arboretum, a huge botanical garden for the public. The 39 bus can also take you there.  Multiple highly-rated restaurants nearby, such as Tres Gatos, Ten Tables, Canary Square Restaurant and more. "
496022,Jamaica Plain,
3987926,Jamaica Plain,"Roslindale is a fun neighborhood in Boston. It is diverse and full of life.  There are many unique family-owned restaurants in Roslindale Square: Indian, Chinese, Nigerian, Pizza, Mexican, Sushi, Italian, Bakery, Cheese Shop, Wine Shop, Fish Market, and more. If you travel a few minutes in the other direction, you can find even more wonderful dining and shops in the Jamaica Plain neighborhood."
2698996,Jamaica Plain,"Jamaica Plain is incredible! We are surrounded by parks, boutiques, restaurants and fun and lively residents! A list of recommended places to visit are located in the room. "
4105704,Jamaica Plain,"This is a wonderful neighborhood and area of the city, a blend of green spaces and easy access to downtown Boston by public transportation. There is the 365 acre Arnold Arboretum, Jamaica Pond with boat rentals and fish stocked and ready, Larz Andersen park - all part of the Emerald Necklace of Boston.   Jamaica Plain Centre is a fun, friendly and eclectic mix of cafes, restaurants, shops, galleries, breweries (Sam Adams), famous and fabulous JP Licks ice cream and the oldest community theatre in the U.S.  We look forward to sharing with you some of our favorite spots."
2798787,Jamaica Plain,"The house is set back in a diverse are that is quiet and friendly.  Jamaica Plain is a great neighborhood in Boston with tons of green space as well as unique shops, restaurants, and things to do."
8720718,Jamaica Plain,"Jamaica Plain is a fun and diverse neighborhood in Boston with great shops and restaurants. Great location to downtown Boston, Longwood medical area, Sam Adams Brewery, Newbury Street, Fenway, and Cambridge."
5874408,Jamaica Plain,"Jamaica Plain is a diverse and vibrant neighborhood of Boston . Our street is residential, yet just a short walk to public transportation that will take you to downtown Boston in 15-20 minutes. The Arnold Arboretum, Franklin Park, Jamaica Pond and downtown Jamaica Plain are all a short walk from our door.  Jamaica Plain has lots of shops, restaurants and cafes, making for a great place to take a walk, window shop, grab a quick bite to eat or enjoy a leisurely meal."
12052288,Jamaica Plain,"This is a very mixed Latino, Irish and Artist neighborhood. There are wonderful street murals throughout Jamaica Plain, beautiful park systems to walk in, easy access to downtown Boston and medical centers. The Sam Adams brewery is less than 2 blocks from our house, and in the brewery complex building is Mike's gym, Ula Cafe and the Milky Way restaurant and bar. Chilacates Mexican restaurant is around the corner and we have any number of great convenient stores in an easy walk. There is a whole foods market and a stop and shop super grocery within a 5 minute drive or 15 minute walk as well."
2308630,Jamaica Plain,"Within 10 minutes walk from the home is: 1. The Arboretum - a great park with lots of walking paths, hills, trees, plants, and flowers! 2. Jamaica Pond - The gem of Jamaica Plain, go for a walk around the pond or just enjoy the view 3. South/Centre Street - cafe's, art, shops, groceries, dinner, and ice cream! 4. Sam Adam's Brewery! - a nice walk down the southwest corridor park takes you up to the Sam Adams Brewery (~15 minutes).  If you're exhausted from all the fun you're having, you can hop on the orange line and take it 1 stop :)  And the tour is free! So much more! If you haven't checked out the airbnb neighborhood review of JP - see it here: https://www.airbnb.com/locations/boston/jamaica-plain"
3079305,Jamaica Plain,"Boston's best neighborhood, no question! Green space with the Arnold Arboretum and Jamaica Pond. Great bars and restaurants. A blossoming art and cycling community. Easy driving, Hubway, or MBTA access to downtown."
4526315,Jamaica Plain,"Jamaica Plain is one of Boston's finest neighborhoods. Located along the Olmsted-designed ""Emerald Necklace,"" JP is a unique blend of top-tier restaurants, cafes, historic homes, stunning green space, and unique shopping. People here love and take great pride in their community, exemplified by the great number of locally-owned enterprises and (website hidden) hosts Jamaica Pond, a beautiful tree-lined pond steps from our home. It offers great walking and running opportunities. The famous Arnold Arboretum - also just a short walk from our home - offers 281 acres of walking and hiking opportunities. All of this - and more - makes JP arguably Boston's most unique neighborhood, and certainly one of its best. You can easily walk to restaurants, cafes, shopping, Jamaica Pond, and the Arnold Arboretum."
6238463,Jamaica Plain,"JP is known for its green space, its diversity of ethnic and economic groups, and its restaurants, shops and galleries.  Jamaica Pond is a block from the house, and the Arboretum is about a half mile walk, Franklin Park and Forest Hills Cemetery are less than a mile away.  JP has some of the best restaurants in town, and many cuisines (Mexican, Thai, Korean, Indian and Middle Eastern, to name a few) are available within a few blocks.  Whole Foods is just down the street.  The original JP Licks, a fabulous ice cream store, is so close you won't be able to resist a late night snack."
2963419,Jamaica Plain,"Jamaica Plain aka JP has old neighborhood charm with a hint of urban sophistication and funk. A safe hood where artists, young parents, and old time Bostonians cross paths. With beautiful architecture, tree-lined streets, and green space (Arnold Arboretum/Jamaica Pond, Emerald Necklace), JP has two forms of public transport for quick downtown access. Local cafes, bars, and boutiques."
12849003,Jamaica Plain,"Neighborhood highlights: Public transportation: MBTA Orange line Green Street Stop (Gets you to downtown Boston in 15 minutes) and the #42 bus stop is in front of our home. Hubway bikes are also right outside of Green st stop.  Lots of restaurants, cafes, and bars: Tres Gatos Tapas place, Ten Tables and JP Seafood (award winning farm-to-table dining), JP Licks (Great ice-cream), great bakeries, Burgers at Grassfed, brunch at Centre Street Café, or Sorellas- the most ingenious pancakes on the planet. Cool Bars: The haven, Canary sq., Bella Luna and the Milky Way, drinking fountain, Midway café.  Cozy Irish bars: James' Gate, Doyle's, Brendan Behan's at Hyde Square, Galway House. Cafés: Canto 6, Fiore's, Blue Frog, Fazenda Coffee Roasters Café  Brewery Tours: Sam Adams, less than 1 mile away, offering free tours Shops including: Whole Foods Market, Stop & Shop, Harvest Green space / Parks great for walks and runs: Beautiful Jamaica Pond, Arnold Arboretum (265-acre park owned by Harvard U"
250983,Jamaica Plain,
2950175,Jamaica Plain,"Jamaica Plain is a very diverse neighborhood in Boston. It offers a quiet place to live, but very close to the city. Near by, there's the Arboretum, some cafes and restaurants, the Jamaica Plain Pond, the Emerald Necklace, and some areas for running."
12930651,Jamaica Plain,"Our apartment is located in a quiet street within Jamaica Plain; a fun, diverse and vibrant neighborhood within the city of Boston. Great attractions within walking distance of our apartment include: - The Arnold Arboretum: a beautiful place to go for a walk, hike or cycle. - Jamaica Pond: go for a walk around the pond, or even rent a row boat!  - The Southwest Corridor (this walking and bicycle path runs parallel to the subway line and you can use it to talk safely all the way to downtown Boston). - Sam Adams Brewery - free tours! - Center Street: JP's main shopping street - offers an eclectic mix of shops and food options. Wonderful cafes, bars and restaurants within walking distance of our apartment include: - Weekend Brunch: VeeVee and Center Street Cafe (amazing homemade donuts!) - Burgers: Grass Fed - Ice Cream: JP Licks (the original branch of this Boston favorite is in our neighborhood) and FOMU (wonderful dairy free ice cream) - Asian: Seafood Cafe, Noodle Barn, Wonder Spice C"
7743569,Jamaica Plain,"Commonly called JP, Jamaica Plain combines enchanting outdoor respites with 19th century triple-decker apartments, homegrown restaurants and parlors, and casual dives. The neighborhood’s mild-mannered community can be found mingling in their beloved public green spaces, Jamaica Pond and Arnold Arboretum. Despite its robust natural attractions, this neighborhood seldom feels crowded. Looking for fast paced urban environs? The rush of Downtown is just a half hour T-ride away."
11514237,Jamaica Plain,"this is a prime location for jamaica plain! just a 3 minute walk to the Green st station on the orange line and a 10 minute walk to the #39 bus which takes you into backbay/copley via the Museum of Fine Arts and many universities. the location is about a 10 minute walk from the center of jp, which hosts everything from amazing dive bars to gourmet tacos to korean food to grassfed burgers. there are wonderful shops and thrift stores nearby, as well as beautiful parks like the arboretum and jamaica pond. JP is a diverse area - don't forget to walk down washington street and get a taste of some dominican rice and beans!"
8310894,Jamaica Plain,
519272,Jamaica Plain,"We live in the Stony Brook neighborhood, a block away from Franklin park, and a ten minute walk from the Arnold Arboretum.  The heart of the nightborhood is the community garden, the Minton Stable Garden, which hosts regular summer cookouts, and houses plots of local gardeners.  People in the neighborhood tend to say hello to each other.  We participate in weekly community dinners, so if you join us on a Monday or Tuesday night, you'll have a chance to get to know other people who live in the neighborhood. "
1612842,Jamaica Plain,
3988018,Jamaica Plain,"Roslindale is a fun neighborhood in Boston. It is diverse and full of life.  There are many unique family-owned restaurants in Roslindale Square: Indian, Chinese, Nigerian, Pizza, Mexican, Sushi, Italian, Bakery, Cheese Shop, Wine Shop, Fish Market, and more. If you travel a few minutes in the other direction, you can find even more wonderful dining and shops in the Jamaica Plain neighborhood."
4025194,Jamaica Plain,"Roslindale is a fun neighborhood in Boston. It is diverse and full of life.  There are many unique family-owned restaurants in Roslindale Square: Indian, Chinese, Nigerian, Pizza, Mexican, Sushi, Italian, Bakery, Cheese Shop, Wine Shop, Fish Market, and more. If you travel a few minutes in the other direction, you can find even more wonderful dining and shops in the Jamaica Plain neighborhood."
568234,Jamaica Plain,"People want to live and visit Jamaica Plain because it has a hip vibe, is close to downtown, and has the most parks in the entire metropolitan area. My house sits at the foot of Sumner Hill which is filled with Victorian Mansions. It's fun to stroll around and imagine upper class life in the late 1800's. You can get a sense of what upper class life was like in the late 19th century.  There is also a house dating from the 1700's on the main drag - Center Street.  That's where the action is and it's only a 5 minute walk from my house.  There, you find an organic grocery, great restaurants, and cool coffee shops. The Arnold Arboretum and Franklin Park total over 500 acres of open space and are less than a 10 minute walk. They are part of the Emerald Necklace Greenway which was designed by Olmstead - who also designed Central Park. The wonderful lake, Jamaica Pond, is also nearby.  Most of my guests love to take a walk or run in the Arboretum. When you arrive, I'll give you a comprehensive"
3616081,Jamaica Plain,"Ahhh...Jamaica Plain, Boston. This is (honestly) the nicest, most eclectic, beautiful, and interesting section of the city. Lots of green, interesting architecture, parks, the Emerald Necklace bike and walking path, Arnold Arboretum, Jamaica Pond, excellent public transportation, sweet driving, easy parking, kid, elderly, and diversity friendly, along with restaurants that range from local health food to ethnic delights, and everything in between. The thing I love about my neighborhood is that no matter who you are, what language you speak, what job you do, your political inclinations, your passions & interests, your degree of desire for interaction, your economic circumstance, the purpose of your visit, or any other defining characteristic, you will never be the 'only one'. Stand at the Stony Brook Train station (4 minute walk) and you'll see briefcases and suits on their way to the financial district, moms with strollers, dog walkers with leashes, artists with portfolios, builders wi"
210097,Jamaica Plain,"Jamaica Plain is a trendy, lovely neighborhood of Boston within 10 minutes of downtown Boston via subway.  We are surrounded by many green spaces.  All kinds of people feel comfortable in JP, as we call it.  We are tolerant of differences of all kinds."
4583526,Jamaica Plain,"You can walk to Arnold Arboretum in minutes and it is beautiful in all seasons. Jamaica Pond is just a mile away. The center of Jamaica Plain is a short 8 minute walk. The neighborhood is  a friendly place. I love it for its music, restaurants, shops and natural beauty- and for its wonderful mix of people."
3957602,Jamaica Plain,"Leafy, diverse, urban neighborhood with bodegas and an awesome bakery and cafe, each 2 blocks away. We are also surrounded by green space: Franklin Park (5 blocks), Jamaica Pond (6 blocks) and the Arboretum is down the bike path 10 min or one subway stop and a two minute walk."
