id,neighborhood,neighborhood_overview
6645010,Roxbury,"I am going to say first that I adore my neighborhood.  However, what I adore about it seems to be the same attributes that make others uncomfortable or feel unsafe.  We live in an area of Boston known as Dorchester, specifically on the border of the Egleston Square section of Jamaica Plain.  This is a residential part of Boston that has been largely neglected by the city and overall development.  Therefore, the buildings are older, many sad and vacant.  The upside of this is that lower-income families are able to afford these homes and so we have a lot of kids and families in the area.  There is also a branch of the Boston Public Library two blocks away!  Franklin Park, one of the famous nature areas of Boston is visible from the corner of our street, and directly diagonal from the bus stop.  This is a great place to go for walks or get a run in in the early mornings (I've even seen people cross-country skiing when there is snow on the ground)!  A number of Bodegas are also within easy"
8735827,Roxbury,"Located in historic Highland Park/Fort Hill. This wonderful neighborhood is diverse in both people and architecture. It has a progressive and engaged group of residents that nurture, lots of public spaces, urban wilds (including our wild turkeys that live very close to the house), community gardens, and a host to passive houses and energy-positive homes. Since 1630, this neighborhood has hosted historic figures from John Eliot (a missionary, whom some called “the apostle to the Indians” and was the founder of Roxbury Latin School) to George Washington (who camped on the green in front of the Dillaway Thomas House the night before The Siege of Boston) to Louis Prang (""father of the American Christmas card"" and the lithographic crayon) to the famous abolitionist William Lloyd Garrison (whose home, Rockledge, is nearby in the neighborhood).   Highland Park/Fort Hill is 3 miles from Downtown Boston and very close to the vibrant and hip Centre Street area in Jamaica Plain, Brigham’s Circle "
3602379,Roxbury,The proximity to nearly every and anything in Boston and Cambridge.
1374434,Roxbury,"Architecturally and geologically interesting; historic, residential, and quiet neighborhood with a racially, ethnically, and economically diverse population.  Formerly, the ""Boston Highlands"", the neighborhood is now called Highland Park or Fort Hill and is on a hill.  "
9694218,Roxbury,"Fort Hill is home to an ethnically and linguistically diverse community.  Over the last decade Fort Hill has experienced an influx of professionals, artists and students, many of whom attend Harvard Medical School, Northeastern University, Massachusetts College of Art and Design or Wentworth Institute of Technology. Fort Hill is also to many medical professionals who work at Brigham and Woman's Hospital, Beth Israel Deaconess Medical Center, and Boston Children's Hospital."
5269216,Roxbury,Great restaurants and young-hip area.
1342370,Roxbury,
7293671,Roxbury,
12368082,Roxbury,"Very close to transportation (bus or orange line). One of the largest Olmstead Parks (Franklin Park) is just a 10 minute walk. Close to great restaurants and bakeries in Jamaica Plain like Ula Cafe, Ten Tables, etc."
4263736,Roxbury,"Located in historic Fort Hill (Highland Park), my home is in a diverse urban residential/bedroom community. Steeped in history since the 1630, this hill has hosted figures such as several of the key founders of Harvard University, George Washington and Henry Knox during the Siege of Boston in the revolution, to the famous abolitionist William Llyod Garrison (whose home is close by and the water fountain in front of the house is designed in his image). After transforming into one of the nations first street car suburbs, now Fort Hill is one of the most sought after and up and coming residential neighborhoods in the city with a diverse community of young professionals, working class and long time residents. We are 2.7 miles (4.3km) from downtown, off the vibrant and hip Centre st in JP, and down Tremont st from some of the best restaurants in the city located in the South End. The neighborhood is a history lover or architects dream with every period represented, has a progressive and eng"
13979354,Roxbury,"Neighborhood is quiet, lots of families, very cozy."
8153848,Roxbury,We are in a college type of area being that Roxbury Community College is next door.
3727560,Roxbury,"The neighborhood is diverse and eclectic. There are many renovated homes, historical homes and churches in the neighborhood. I have many wonderful neighbors and our street is truly a community. "
1175376,Roxbury,
1850260,Roxbury,"The neighborhood is multi culturally mixed with whites and blacks, Hispanic, predominantly black."
12351909,Roxbury,"It's pretty residential on the street, but places to eat and shop start showing up about 10 minutes away on foot.  You'll also be close to the T so you can get practically anywhere.  Jamaica Plain is right around the corner - a diverse assortment of restaurants can be found there, as well as a Whole Foods if you'd rather stay in and cook.  The renowned Sam Adams brewery is only 2 stops away by T."
801722,Roxbury,"Peaceful, Cool Architecture, historic, diverse, and quiet neighborhood. Racially, culturally,  ethnically, and economically diverse."
4555637,Roxbury,"Located in historic Fort Hill (Highland Park), my home is in a diverse urban residential/bedroom community. Steeped in history since the 1630, this hill has hosted figures such as several of the key founders of Harvard University, George Washington and Henry Knox during the Siege of Boston in the revolution, to the famous abolitionist William Llyod Garrison (whose home is close by and the water fountain in front of the house is designed in his image). After transforming into one of the nations first street car suburbs, now Fort Hill is one of the most sought after and up and coming residential neighborhoods in the city with a diverse community of young professionals, working class and long time residents. We are 2.7 miles (4.3km) from downtown, off the vibrant and hip Centre st in JP, and down Tremont st from some of the best restaurants in the city located in the South End. The neighborhood is a history lover or architects dream with every period represented, has a progressive and eng"
2636365,Roxbury,"There are a few places to eat in the immediate neighborhood. My local grub favorite is good eats. Get the signature sub!  I also really like Pinto Bangkok, they produce really fresh Thai food. Let me know what you think of their green curry! If you're interested in watching a game try Pariah Cafe on Tremont for a beer and sandwich."
8228903,Roxbury,The Ashur Restaurant next door gives our guest a 15% discount of food purchases.
13796564,Roxbury,
8310807,Roxbury,The Ashur restaurant next door gives our guest a 15% discount on any food ordered there.
13653233,Roxbury,"This prime location apartment is walking distance from all of South End's unique attractions. Look for events by the SoWa Artists' Guild or take in Boston's renowned South End Open Market (Sundays from May 1 to Oct 30)! Good eats are just around the corner in Lower Roxbury proper, with highly-rated Spanish tapas restaurant Toro, or nearby Teranga for Senegalese fare.  Lower Roxbury is one of Boston's up and coming areas. It's home to many of Northeastern University's newest buildings and is just blocks from the trendy and chic South End neighborhood. A hop, skip, and jump brings you right into downtown Boston as the area is very accessible to public transportation. As one can imagine it is mainly inhabited by students and long time city residents."
5717690,Roxbury,"The South End is a very urban, walk-able neighborhood in Boston. Known for its many parks, restaurants and artistic culture, this neighborhood has been the ""hottest"" in Boston's real estate market. Young families, professionals, doctors/nurses and empty nesters will enjoy this location."
4205641,Roxbury,"Apartment complex is located within a research medical area(BU's Boston Medical Center) which attracts people from all over the U.S and the world... because of this you will see a very diverse mix of people The South End being the gay neighborhood of the city makes this an area that may not be up to everyone's tolerance levels, be very mindful of this fact to avoid any disappointment about the location.  The brick sidewalks, the rows of brownstone and brick townhouses with their tiny gardens, the parks, the playgrounds, and the community gardens are a visual treat... just across the street! *If you feel uncomfortable/unsafe around poor, old, black, gay or different go to Back Bay!"
349347,Roxbury,
1550047,Roxbury,
3343428,Roxbury,"Located in historic Fort Hill (Highland Park), my home is in a diverse urban residential/bedroom community. Steeped in history since the 1630, this hill has hosted figures such as several of the key founders of Harvard University, George Washington and Henry Knox during the Siege of Boston in the revolution, to the famous abolitionist William Llyod Garrison (whose home is close by and the water fountain in front of the house is designed in his image). After transforming into one of the nations first street car suburbs, now Fort Hill is one of the most sought after and up and coming residential neighborhoods in the city with a diverse community of young professionals, working class and long time residents. We are 2.7 miles (4.3km) from downtown, off the vibrant and hip Centre st in JP, and down Tremont st from some of the best restaurants in the city located in the South End. The neighborhood is a history lover or architects dream with every period represented, has a progressive and eng"
10190260,Roxbury,"The historic South End of Boston is one for the record books.  It is the largest, contiguous Victorian neighborhood in the United States.  Almost entirely built of red brick, with few exceptions, the city has the entire district protected as a much loved neighborhood; the BEST in Boston by far!!  Bring your camera!!  This building is in the west end of the South End, not too far from newly rebuilt Dudley Square.  Large, new supermarket just 5 minutes walk towards Dudley Square.  They sell it all! "
3522237,Roxbury,
12756776,Roxbury,
7784616,Roxbury,"- 7 minute walk to Northeastern University and New England Conservatory - 15 minute walk to the Prudential Center and Newbury St. (shopping area) - Whole Foods, Trader Joe's, and Star Market all within 15 minutes walking distance"
4568116,Roxbury,"Located in historic Fort Hill (Highland Park), my home is in a diverse urban residential/bedroom community. Steeped in history since the 1630, this hill has hosted figures such as several of the key founders of Harvard University, George Washington and Henry Knox during the Siege of Boston in the revolution, to the famous abolitionist William Llyod Garrison (whose home is close by and the water fountain in front of the house is designed in the profile of his face). After transforming into one of the nations first street car suburbs, now Fort Hill is one of the most sought after and up and coming residential neighborhoods in the city with a diverse community of young professionals, working class and long time residents. We are 2.7 miles (4.3km) from downtown, off the vibrant and hip Centre st in JP, and down Tremont st from some of the best restaurants in the city located in the South End. The neighborhood is a history lover or architects dream with every period represented, has a progr"
1403408,Roxbury,"Architecturally interesting, historic, economically, ethnically, and racially diverse, and quiet residential neighborhood.  Both urban and suburban vibe depending on who is out and about and the time of year."
3057116,Roxbury,"We are very convenient to Downtown, and our neighborhood offers plenty of its own charm, as well. Close to Franklin Park, which features a public golf course and a popular zoo! Very diverse neighborhood with lots of ethnic dining options, plus typical American pub food."
3888360,Roxbury,"Boston has 13 cities in it. It goes like Downtown Boston, Back Bay and then is Roxbury Crossing. Guild street where the house is located is in Roxbury Crossing which is five minutes from Dudley Station. That particular neighborhood and its hill area called Forth Hill. It is that start street of Forth Hill. When you walk from Dudley Station you will see  a police station on your right almost half way in between."
1374466,Roxbury,"Architecturally interesting, quiet, historic, and economically, ethnically and racially diverse,  neighborhood. "
3656168,Roxbury,"Peaceful and orderly neighborhood. Near the house are ; a Boston Police Department station, a supermarket, a small shopping mall, Walgreens, and a YMCA. This YMCA has a nice gym, sauna and a swimming pool. If you walk onto Blue Hill Ave, you will see a Super Stop & Shop, Bank of America, CVS and Dunkin' Donuts."
69369,Roxbury,"Architecturally interesting, historic, and often quiet neighborhood. Racially, ethnically, and economically diverse."
4560053,Roxbury,"Eclectic, Architecturally interesting, historic, diverse, and quiet neighborhood. Racially, ethnically, and economically diverse."
5506,Roxbury," Peacful, Architecturally interesting, historic, diverse, and quiet. Racially, culturally,  ethnically, and economically diverse."
6080461,Roxbury,"Peaceful, Architecturally interesting, historic, diverse, and quiet. Racially, culturally, ethnic, and economically diverse."
2473997,Roxbury,"Dudley square is an up and coming working class area with many causal eateries and a fabulous non-profit cafe. A new building with a cafe, pizza place and burger place just opened last fall! We are also walking distance to the South End where you'll find trendy shops and restaurants. For more upscale shopping, the Prudential Center and Newbury Street are less than 2 miles away.  We are also convenient to Fenway Park, the Museum of Fine Arts, all downtown locations, and many local colleges."
8371203,Roxbury,"Residential neighborhood with stores, recreational centers and public transportation within walking distance."
8238311,Roxbury,We are in a college type of area next to Roxbury Community College.
6780300,Roxbury,It's safe and quiet part of busy metropolitan city.
13054720,Roxbury,"This is a diverse neighborhood with professionals, students and people of every economic level. The neighborhood is central to many universities, hospitals and cultural institutions, including Northeastern University, Harvard Medical, BU Medical, Wentworth, Mass College of Art, Berklee College of Music, New England Conservatory of Music, Children's Hospital, Boston Medical Center, Museum of Fine Arts, Gardner Museum, Symphony. And many more, all within a 10-25 minute walk."
8734707,Roxbury,"Located in the historic Highland Park/Fort Hill section of Roxbury, this wonderful Boston neighborhood is diverse in both people and architecture. It has a progressive and engaged group of residents that nurture, lots of public spaces, urban wilds (including our wild turkeys that live very close to the house), community gardens, and a host to passive houses and energy-positive homes. Since 1630, this neighborhood has hosted historic figures from John Eliot (a missionary, whom some called “the apostle to the Indians” and was the founder of Roxbury Latin School) to George Washington (who camped on the green in front of the Dillaway Thomas House the night before The Siege of Boston) to Louis Prang (""father of the American Christmas card"" and the lithographic crayon) to the famous abolitionist William Lloyd Garrison (whose home, Rockledge, is nearby in the neighborhood).   Highland Park/Fort Hill is 3 miles from Downtown Boston and very close to the vibrant and hip Centre Street area in Ja"
14300921,Roxbury,
2892825,Roxbury,"Friendly , quiet residential neighborhood with professionals and their families as your neighbors.  Some of the neighbors include as CPAs, nurses, teachers, firemen, realtors, business owners, plumbers, electricians, and One judge, one City Council at large and families and retirees. Only about five minutes Walk park zoo and golf , supermarket, coffee, pharmacy, library , postal service Banks and 8 bus lines .Two train stations 10 to 20 minutes walk away. There are many restaurants , most of them are fast food. Good sit down restaurants are two miles away in South End, Fields Corner or Brigham Circle."
8373729,Somerville,
3131519,Somerville,
14603878,Somerville,
14774426,Somerville,
14504583,Somerville,
14400847,Somerville,"The apartment offers a peaceful place to sleep and relax. It is situated on a lovely side street with a broad range of cuisine options nearby. Italian, Mexican, Brazilian, and Ethiopian food are a short walk away! The place is very clean, pet free and perfect for solo adventurers, business travelers and brief vacations."
7853971,South Boston,
11020786,South Boston,"Close to the convention center, public transportation and all of Boston's attractions."
6151079,South Boston,"South Boston (Southie) is one of the hottest neighborhoods in Boston as of late given its proximity to the Seaport area with restaurants, bars and a bustling nightlife. The condo is on the west side of Southie - less than a mile to downtown Boston, Boston Convention Center, and the Seaport area. The condo is also close to South Bay Shopping Center where many shops/super stores are located at including Target, Stop&Shop, TJ Maxx, Best Buy, BedBath&Beyond,...etc.  Andrew Station (T/Red Line) is within minutes walk, providing convenient public transit to South Station and anywhere in the greater Boston area."
11592067,South Boston,
7988755,South Boston,"Southie is the new ""yuppie"" hood of Boston. Vibrant, multicultural with a strong Irish ""cachet"", festive but humble at the same time. A favorite among young professionals and families as well as students and retired people. They are plenty of bars and restaurants, stores and little boutiques, ideally located between Downtown, the Financial District and the beach. Multiple runner circuits available in the area. Please note that South Boston is right next to downtown and financial district, and even if our home has noise cancelling windows, you can still hear in the background some typical ""city"" noise. Again, please also note we live in Boston, not Lalaland. There are homeless people in our neighborhood (and everywhere in and around Boston, the USA and the WORLD!!!), specially around Andrew MBTA Station. They are harmless and I have never been bothered by one (they may ask for spare change but that will be it). The neighborhood is safe, even at night, as long as you don't walk around wi"
13864415,South Boston,"Very nice, quiet and safe neighborhood. Close to D str. square for fun and lots of activities."
11563716,South Boston,"Residents will enjoy the convenient location slightly south of San Francisco’s central business district, on the west coast of the peninsula. The area’s excellent public transportation has many ways to connect to Mission Bay and China Basin, which are just a few stops from city center."
13671334,South Boston,
11276570,South Boston,
13746896,South Boston,
11734812,South Boston,"This building is located in the heart of Boston’s newest neighborhood, Seaport Square. This unique location on Boston Harbor is where the Financial District, the Seaport, and Fort Point meet."
6006121,South Boston,"Our condo is walking distance to shops, restaurants, ATMs,  coffee shops.   A 15-20 minute walk to Boston Convention Center, World Trade Center, Harpoon Brewery, cruise port & Castle Island"
7003280,South Boston,"South Boston is one of Boston's fastest growing neighborhoods. There is easy transportation, shops, restaurants, and even a beach all within walking distance."
4863108,South Boston,
6088708,South Boston,"South Boston (Southie) is one of the hottest neighborhoods in Boston as of late given its proximity to the Seaport area with restaurants, bars and a bustling nightlife. The condo is on the west side of Southie - less than a mile to downtown Boston, Boston Convention Center, and the Seaport area. The condo is also close to South Bay Shopping Center where many shops/super stores are located at including Target, Stop&Shop, TJ Maxx, Best Buy, BedBath&Beyond,...etc.  Andrew Station (T/Red Line) is within minutes walk, providing convenient public transit to South Station and anywhere in the greater Boston area."
8930592,South Boston,"Great Boston location on a quiet street, minutes to all the shops, restaurants and bars. Just one mile from Castle Island and the beach! Beautiful all year round for walks by the ocean. Within a 5 minute walk to plenty of bars and eateries: -Lincoln Tavern & Restaurant -Moko Japanese Cuisine -Cafe Porto Bello Close to the Boston Convention and Exposition Center (BCEC) and Boston's Seaport neighborhood. The Seaport features many great seafood joints and lively bars and restaurants from casual to five star. A few favorites: -The famous Legal Harborside -Jerry Remy's -Yankee Lobster -Harpoon Brewery Cross the bridge from the Seaport and you'll find the North End, or Boston's ""Little Italy"" (but don't call it that!). Great Italian restaurants abound. Get delicious pastry (without the line!) at Bova's, and delicious ground and whole bean coffees at Polcaris."
8052617,South Boston,Awesome location near great restaurants along West Broadway or down in Seaport.
12309083,South Boston,
13951039,South Boston,"Fort Point is the coolest part of Boston. 10min from downtown, and 5min from seaport, the aesthetic is rustic, industrial, and modern. Top restaurants and bars speckle the neighborhood, and though the streets are lively in the daytime and the bars are busy at night, between the hours of 1am and 9am, the neighborhood tucks itself in for a quiet night of sleep."
5163162,South Boston,"It's walking distance (10 mins) from 2 red-line subways that will take you to downtown Boston and Cambridge, and you're also walking distance to Carson Beach (10 mins) where there is beach volleyball in the summer. There are a couple of great restaurants nearby, including one next door (called Telegraph Hill - show them your email reservation for 10% off of food only), and closer to the center of South Boston, there are a number of well regarded fine dining restaurants and bars. Approx $10 Uber ride to the Boston Convention Center (BCEC). Proximity to destinations of interest: 1. The Boston airport is 5.0 miles away and that's a 10 minute drive in normal traffic.  2. The BCEC (Boston Convention & Exhibition Center) is 1.4 miles away or a 32 minute walk or 5 minute drive.  3. The closest subway (""T"") stop is at Andrew Square 0.3 miles away or 8 minute walk 4. Carson Beach and the Joe Moakley sports park is 0.7 miles away or 15 minute walk. 5. Boston Common - the central park of Boston i"
2843596,South Boston,"I love that our neighborhood is in the city, yet it has a quiet, more suburban feel to it. We have a backyard, and our street is mostly quiet. We're in the historically Irish neighborhood, so if you look at many of the front doors, you will see brilliant works of art! In addition, we are super close to the beach and the long loop that goes around Castle Island/Carson Beach. It's great anytime! Otherwise, we have the budding Seaport District within walking distance (20-25 minutes) and Downtown at arm's reach."
11008495,South Boston,"The wonderful neighborhood, known as Southie, is a tight knit neighborhood filled with young families and professionals. Within a few blocks are many fanstaic restaurants including; Lincoln Tavern and Restaurant, Loco Taqueria and Oyster Bar and Stats Bar and Gril. A few minute Uber ride will bring you to the Seaport with numerous restaurants consisting of Del Frisco's, Temazcal, Legal Sea Foods, Empire, and Morton's. The Harpoon Brewery, with their beer hall and tasting room, is located in the Seaport as well. The Broadway T stop (Red Line) is a 10-12 minute walk with newly opened Worden Hall and Coppersmith adding to the area."
2022303,South Boston,South Boston is a great place to base yourself because of the proximity to the heart of the City while maintaining its own identity and  neighborhood feel.
7933149,South Boston,"The location could not be more perfect with all of South Boston at your doorstep and the wildly popular Seaport District just a short walk away. South Boston, or “Southie” as we call it, is best known for its authentic Boston feel, its proximity to Downtown and it’s bar and pub scene, while the Seaport District has quickly become the destination for conferences, restaurants and night-life/entertainment. With the Red Line Subway station right outside the front door you can also access the Downtown/Financial District, Beacon Hill and Cambridge/MIT/Harvard very easily."
13514017,South Boston,
10138792,South Boston,
13510994,South Boston,
14186170,South Boston,
11653496,South Boston,"South Boston (Southie) is one of the hottest neighborhoods in Boston as of late given its proximity to the Seaport area with restaurants, bars and a bustling nightlife. The condo is on the west side of Southie - less than a mile to downtown Boston, Boston Convention Center, and the Seaport area. The condo is also close to South Bay Shopping Center where many shops/super stores are located at including Target, Stop&Shop, TJ Maxx, Best Buy, BedBath&Beyond,...etc.  Andrew Station (T/Red Line) is within minutes walk from my condo, providing convenient public transit to South Station and anywhere in the greater Boston area."
