id,neighborhood,neighborhood_overview
13830152,Charlestown,
13064781,Charlestown,
5620496,Charlestown,"Everything is within walking distance!  Restaurants, Wholefoods, coffee shops, hardware store, florist, liquor store - all within a few blocks!!!"
708802,Charlestown,
13032590,Charlestown,"This is a busy urban neighborhood next to a T stop and  us hub. It is a very convenient location which allows you to easily get to the most important places in Boston and Cambridge. There is Dunkin Donuts just a block away, Asian House restaurant, ATM, and a Tavern. If you take Orange line outbound, the next stop is Assembly Square-you will find a large variety of stores, coffee shops, and restaurants in there."
12825412,Charlestown,"Charlestown is a quaint, historic neighborhood (the oldest in Boston!) that offers cozy side streets and hidden parks to explore. The expanding restaurant options include: Navy Yard Bistro - Great Al Fresco Dining  Legal Oysteria - Italian Seafood Tangerino - Morrocan /North African food with hookah bar and belly dancers Paolo's - Traditional Italian American The Brewers Fork - A quirky brew pub that features an eclectic selection of  local and international beers and wood fired cuisine"
77681,Charlestown,
1587540,Charlestown,"I love our neighborhood of Charlestown! It's a part of Boston that is truly underrated. We routinely go for walks downtown, to the north end, to the harbor walk, and to local pubs and cafes. Part of C-town feels very colonial - the gas lit streets, the red brick townhouses, the Bunker hill monument, the Warren tavern. And other parts feel very maritime - the docks, pier 6 tavern, Old Ironsides. And all of it is a young living neighborhood with easy access to the T, buses, Whole Foods, and cafes. Although we see tourists all the time on the Freedom Trail, it's a real neighborhood with people playing football in the street with their kids, neighbors catching up on the sidewalk, and fun local traditions."
45987,Charlestown,Historical and safe.
6268805,Charlestown,"Situated on the banks of Boston Harbor and the Mystic River on the north side of the city, Charlestown has translated its historical roots into a thriving 21st Century neighborhood. As the home to such significant landmarks as the U.S.S. Constitution, the Bunker Hill Monument and the Navy Yard, the Charlestown neighborhood boasts the most charming picturesque streets without all the hustle and bustle of the city.  Downtown is a short walk where you can access the historic North End, Haymarket, Fanuiel Hall and Beacon Hill. Spend one night in Charlestown and you will for sure fall in love with the best neighborhood in Boston! Love the easy access to the ""T,"" major highways and everything the city has to offer while maintaining a quiet and safe neighborhood feel. Bunker Hill Monument park, Warren Tavern and The Freedom Trail are a few ""musts"" just around the corner!"
6886946,Charlestown,"Charlestown is the oldest neighborhood in Boston and contains several places of historic interest, all within walking distance. Visit the Bunker Hill Monument, Old Ironsides docked in the Navy Yard on the harbor, and continue along Boston’s Freedom Trail for more history!"
5719606,Charlestown,"Charlestown is a prestigious, historic oasis located 5 minutes away from downtown Boston."
5726250,Charlestown,"Our neighborhood is very quiet, yet you are close to everything you need or want to explore in Boston.  We have great restaurants/coffee shops, parks, grocery stores, outlet shopping 1.5 miles away, bike trails along the waterfront, a full track field across the street for running or outdoor play.  Everything is walkable in our town, that is why we love it!"
4112178,Charlestown,
14013583,Charlestown,
3721095,Charlestown,"Charlestown has all the great traits of a neighborhood while still being located in the city. This apartment is a 5-10 minute walk from a variety of amenities such as restaurants and bars, parks, and other historical sites."
29765,Charlestown,
5076880,Charlestown,"I love the history of Charlestown and how friendly everyone is. I have lived in other parts of the city and never have I felt more at home than I do in Charlestown. So many things are in walking distance: grocery stores, bars, restaurants, coffee shop, etc. The North End, TD Garden and Navy Yard are only a 10 walk, too! I take a look left out my front door and see the Bunker Hill Monument and a look right and see City Square and the Zakim Bridge. Can't beat that!"
44205,Charlestown,
93505,Charlestown,The neighborhood is a mix of life long Townies and many newer residents. A good mix.
2167993,Charlestown,"It is on the waterfront, few steps from the Boston Harbor Walk deck, quiet and safe, yet 15-20 minutes walk from downtown Boston and Cambridge. The Navy Yard is very popular place to live for young professionals, especially in research, medical, biotech, financials due to the proximity to these institutions around. The USS Constitution Tall Ship - the oldest all sails warship in service by the US Navy is open for visitors year round, the US Constitution Museum, the Freedom Trail etc. are three blocks away"
5813992,Charlestown,"In the heart of Charlestown. Right across from the shopping plaza which features stores like Whole Foods, CVS, postal office, Super cuts, Dunkin Donuts, Zumes Coffee shop, Citizen's Bank, etc.  Free street parking Saturday/Sunday. 2h limited street parking during the week 8-6 pm. Free week night parking after 6 pm. For full day, non residential parking check online options:  (URL HIDDEN)"
82637,Charlestown,
5684598,Charlestown,"Charlestown is the oldest neighborhood in Boston.  The Charlestown Navy Yard is a unique area, it was originally developed as a location to repair military ships and today retains a lot of the historic culture.  First-class restaurants and friendly coffee shops, wine bistros and waterfront taverns, all combine to create an array of delightful diversions."
7472068,Charlestown,"Charlestown is home to two significant historical sites: the USS Constitution, and the Bunker Hill monument. These Freedom Trail finds make most ""must"" lists for Boston residents and visitors alike. Enjoy a stroll through the Navy Yard to check out Old Ironsides then head up the hill to see why Bunker Hill played such a prominent role the our fight for Freedom. This American Revolution landmark sits high above the city's landscape allowing a spectacular view of the water below. Very easy access to all of Boston as well!!"
13585624,Charlestown,"Charlestown is truly a residential neighborhood with quiet, tree-lined streets and historic squares and monuments. Yet its residents enjoy convenient and easy access to many services within a short walk, as well as downtown Boston and Cambridge via public transit."
14767573,Chestnut Hill,"Location, location, location. Cited as the three most important factors in determining the desirability of any residential property, the significance of location for any Boston, MA apartment community cannot be overstated. Fortunately, Chestnut Hill Realty is well aware of this fact, and we've made every effort to ensure that apartment rentals are not only well-positioned within their neighborhoods - close to public transportation, schools and shopping, but that the neighborhoods they are a part of are desirable and well-placed. We've sought out property locations in and around the Boston, Portsmouth and Providence areas with our residents in mind - and as a result we're able to offer the best value in apartment living in some of the most unique and interesting communities in the country."
14743129,Chestnut Hill,"走路2 minutes有shopping mall,包括CVS,restuarant,bank,dentist和几个购物商店"
12986016,Chinatown,
10117803,Chinatown,"Major Attractions: •Restaurants – The Q Restaurant (1 min), Artisan Bistro (.1 mi), My Thai Vegan Café (1 min), Sip Wine Bar and Kitchen (.1 mi) •Faneuil Hall for shopping and dining – .8 mi •Shops at Prudential Center – 2 mi •Downtown Crossing  featuring local events, eclectic nightlife, history and culture – Freedom Trail, over 100 restaurants, and over 500 retailers – .4 mi •Massachusetts Convention Center – 1.1 mi •Copely Square - .8 mi •New England Aquarium – 1.2 mi •Boston Opera House - .5 mi •Near Tufts University (6.9 mi), Tufts Medical Center (1.1 mi), and Emerson College (.2 mi)"
3342206,Chinatown,"This exceptional property is located close to several Boston most compelling neighborhoods near the Rose Kennedy Greenway. Residents can enjoy a convenient location with nearby transportation hubs, making all areas of Boston easily accessible, along with the finest dining, shopping and entertainment. "
7630340,Chinatown,
10116726,Chinatown,"Major Attractions: •Restaurants – The Q Restaurant (1 min), Artisan Bistro (.1 mi), My Thai Vegan Café (1 min), Sip Wine Bar and Kitchen (.1 mi) •Faneuil Hall for shopping and dining – .8 mi •Shops at Prudential Center – 2 mi •Downtown Crossing  featuring local events, eclectic nightlife, history and culture – Freedom Trail, over 100 restaurants, and over 500 retailers – .4 mi •Massachusetts Convention Center – 1.1 mi •Copely Square - .8 mi •New England Aquarium – 1.2 mi •Boston Opera House - .5 mi •Near Tufts University (6.9 mi), Tufts Medical Center (1.1 mi), and Emerson College (.2 mi)"
10611728,Chinatown,"Major Attractions: •Rose Kennedy Greenway – public park featuring contemporary art, water features, modern landscaping, food trucks, and seasonal events – .3 mi •Restaurants – The Townsman – located at the base of the Radian, Shabu-Zen (.2 mi), New Jumbo Seafood (.1 mi), Blu (.3 mi), Artisan Bistro (.3 mi) •Whole Foods for groceries - .6 mi •The Shops at Prudential Center – 1.2 mi •House of Blues – 2 mi •Museum of Fine Arts – 2.2 mi •Prudential Skywalk – highest observation deck in New England -1.3 mi •Historical Freedom Trail walking tour – .6 mi •Faneuil Hall – .6 mi •Fenway Park – 2.3 mi •Boston University (3 mi),  Northeastern University (1.7 mi), and Harvard (4.2 mi) •Boston Children’s Hospital – 2.4 mi"
2187766,Chinatown,"This elegant building is perfectly situated in the heart of Boston, right in Chinatown, between the Theater District and the Financial District with several attractions nearby including Boston Faneuil Hall, Freedom Trail, Downtown Crossing and New England Aquarium. "
2848362,Chinatown,"Right across the street is Boston's Chinatown, a constantly lively part of the city - There's a 24 hr diner, plenty of restaurants closing near 3 am and several bars and lounges surrounding the area. There are 'hubway' or bike rentals near the apartment for your leisurely traveling needs."
7434871,Chinatown,"Boston's vibrant theater scene includes more than a dozen major performance venues in the Downtown Theatre District.  Bordering Chinatown and the Leather District.  Only minutes to South Boston where the new Waterfront area offers many dining options, the Convention Center(s), and more."
1966195,Chinatown,"This elegant building is perfectly situated in the heart of Boston, right in Chinatown, between the Theater District and the Financial District with several attractions nearby including Boston Faneuil Hall, Freedom Trail, Downtown Crossing and New England Aquarium. "
12383703,Chinatown,"Major Attractions: •Restaurants – The Q Restaurant (1 min), Artisan Bistro (.1 mi), My Thai Vegan Café (1 min), Sip Wine Bar and Kitchen (.1 mi) •Faneuil Hall for shopping and dining – .8 mi •Shops at Prudential Center – 2 mi •Downtown Crossing  featuring local events, eclectic nightlife, history and culture – Freedom Trail, over 100 restaurants, and over 500 retailers – .4 mi •Massachusetts Convention Center – 1.1 mi •Copely Square - .8 mi •New England Aquarium – 1.2 mi •Boston Opera House - .5 mi •Near Tufts University (6.9 mi), Tufts Medical Center (1.1 mi), and Emerson College (.2 mi)"
10116429,Chinatown,"Major Attractions: •Restaurants – The Q Restaurant (1 min), Artisan Bistro (.1 mi), My Thai Vegan Café (1 min), Sip Wine Bar and Kitchen (.1 mi) •Faneuil Hall for shopping and dining – .8 mi •Shops at Prudential Center – 2 mi •Downtown Crossing  featuring local events, eclectic nightlife, history and culture – Freedom Trail, over 100 restaurants, and over 500 retailers – .4 mi •Massachusetts Convention Center – 1.1 mi •Copely Square - .8 mi •New England Aquarium – 1.2 mi •Boston Opera House - .5 mi •Near Tufts University (6.9 mi), Tufts Medical Center (1.1 mi), and Emerson College (.2 mi)"
4445906,Chinatown,"This elegant building is perfectly situated in the heart of Boston, right in Chinatown, between the Theater District and the Financial District with several attractions nearby including Boston Faneuil Hall, Freedom Trail, Downtown Crossing and New England Aquarium. "
11983535,Chinatown,"Major Attractions: •Restaurants – The Q Restaurant (1 min), Artisan Bistro (.1 mi), My Thai Vegan Café (1 min), Sip Wine Bar and Kitchen (.1 mi) •Faneuil Hall for shopping and dining – .8 mi •Shops at Prudential Center – 2 mi •Downtown Crossing  featuring local events, eclectic nightlife, history and culture – Freedom Trail, over 100 restaurants, and over 500 retailers – .4 mi •Massachusetts Convention Center – 1.1 mi •Copely Square - .8 mi •New England Aquarium – 1.2 mi •Boston Opera House - .5 mi •Near Tufts University (6.9 mi), Tufts Medical Center (1.1 mi), and Emerson College (.2 mi)"
2722165,Chinatown,"A few blocks from Boston's South Station and every major subway line as well as the park, attractions and food, this is urban living at its best.  Walk everywhere and enjoy exploring what the city has to offer. The Leather District is mostly remodeled textile factory buildings turned into lofts.  Chinatown is vibrant, has great, inexpensive Chinese, Vietnamese, Thai, Malaysian and Japanese food.  The waterfront and park as well as historic Beacon Hill are all within walking distance.  You will have access to convenience stores, groceries, easily can go for a walk or run in the park or check out a movie, go to a show in the nearby theatre district.  The environment is densely urban and diverse and the loft, perched several stories above, provides a peaceful oasis in the middle of it all."
6452246,Chinatown,"Neighborhoods: The apartment is uniquely located at the intersection of several great Boston neighborhoods: Chinatown, the Theater District, the Leather District and the South End. Many more great neighborhoods are within easy walking distance including Back Bay, Beacon Hill, the Waterfront, the Seaport District and Fort Point.  Some Notable Nearby Locations/Attractions:  -Boston Common and Public Garden -Rose Kennedy Greenway -Charles River Esplanade -SoWa Sundays -Newbury Street  -Freedom Trail -South Station Nearby Hospitals: Location is close to many of Boston's major hospitals, which makes it a great place to stay during a rotation or an interview. -Tufts Medical Center (walk: 5 min) -Boston Medical Center (walk: 20 min; bus: 15 min; drive: 5 min) -Massachusetts General Hospital (MGH) (walk: 25 min; subway: 20 min; drive: 10 min)  Nearby Schools and Universities: Location is steps away from the Tufts University Health Sciences campus (5 min walk). The Boston University Medical Cam"
2848330,Chinatown,"Right across the street is Boston's Chinatown, a constantly lively part of the city - There's a 24 hr diner, plenty of restaurants closing near 3 am and several bars and lounges surrounding the area. There are 'hubway' or bike rentals near the apartment for your leisurely traveling needs."
12383204,Chinatown,"Major Attractions: •Restaurants – The Q Restaurant (1 min), Artisan Bistro (.1 mi), My Thai Vegan Café (1 min), Sip Wine Bar and Kitchen (.1 mi) •Faneuil Hall for shopping and dining – .8 mi •Shops at Prudential Center – 2 mi •Downtown Crossing  featuring local events, eclectic nightlife, history and culture – Freedom Trail, over 100 restaurants, and over 500 retailers – .4 mi •Massachusetts Convention Center – 1.1 mi •Copely Square - .8 mi •New England Aquarium – 1.2 mi •Boston Opera House - .5 mi •Near Tufts University (6.9 mi), Tufts Medical Center (1.1 mi), and Emerson College (.2 mi)"
13813380,Chinatown,
2848393,Chinatown,"Right across the street is Boston's Chinatown, a constantly lively part of the city - There's a 24 hr diner, plenty of restaurants closing near 3 am and several bars and lounges surrounding the area. There are 'hubway' or bike rentals near the apartment for your leisurely traveling needs."
12067685,Chinatown,
2848239,Chinatown,"Right across the street is Boston's Chinatown, a constantly lively part of the city - There's a 24 hr diner, plenty of restaurants closing near 3 am and several bars and lounges surrounding the area. There are 'hubway' or bike rentals near the apartment for your leisurely traveling needs."
1868124,Chinatown,"This elegant building is perfectly situated in the heart of Boston, right in Chinatown, between the Theater District and the Financial District with several attractions nearby including Boston Faneuil Hall, Freedom Trail, Downtown Crossing and New England Aquarium. "
2848370,Chinatown,"Right across the street is Boston's Chinatown, a constantly lively part of the city - There's a 24 hr diner, plenty of restaurants closing near 3 am and several bars and lounges surrounding the area. There are 'hubway' or bike rentals near the apartment for your leisurely traveling needs."
13079659,Chinatown,"Downtown Crossing is a shopping district that is a small part of downtown Boston, Massachusetts, located due east of Boston Common and west of the Financial District. It features large department stores as well as restaurants, souvenir sellers, general retail establishments, and street vendors"
13024385,Chinatown,"This apartment is right downtown in a central location. You're moments away from many of Boston's attractions including Boston Common and the Opera House, as well as shopping at department stores like Macy's and Primark. This apartment is also right next to Boston's historic Chinatown neighborhood and a few blocks away from the distinctive Paifang Gate. Try some of the local grub like Gourmet Dumpling House (3 minutes by foot) or French-style cuisine at Troquet (4 minutes by foot). Then check out Sip Wine Bar (2 minutes by foot) for a cocktail or a glass of wine.  Downtown Crossing is a shopping district that is a small part of downtown Boston, Massachusetts, located due east of Boston Common and west of the Financial District. It features large department stores as well as restaurants, souvenir sellers, general retail establishments, and street vendors"
12303347,Chinatown,"Major Attractions: •Rose Kennedy Greenway – public park featuring contemporary art, water features, modern landscaping, food trucks, and seasonal events – .3 mi •Restaurants – The Townsman – located at the base of the Radian, Shabu-Zen (.2 mi), New Jumbo Seafood (.1 mi), Blu (.3 mi), Artisan Bistro (.3 mi) •Whole Foods for groceries - .6 mi •The Shops at Prudential Center – 1.2 mi •House of Blues – 2 mi •Museum of Fine Arts – 2.2 mi •Prudential Skywalk – highest observation deck in New England -1.3 mi •Historical Freedom Trail walking tour – .6 mi •Faneuil Hall – .6 mi •Fenway Park – 2.3 mi •Boston University (3 mi),  Northeastern University (1.7 mi), and Harvard (4.2 mi) •Boston Children’s Hospital – 2.4 mi"
10116601,Chinatown,"Major Attractions: •Restaurants – The Q Restaurant (1 min), Artisan Bistro (.1 mi), My Thai Vegan Café (1 min), Sip Wine Bar and Kitchen (.1 mi) •Faneuil Hall for shopping and dining – .8 mi •Shops at Prudential Center – 2 mi •Downtown Crossing  featuring local events, eclectic nightlife, history and culture – Freedom Trail, over 100 restaurants, and over 500 retailers – .4 mi •Massachusetts Convention Center – 1.1 mi •Copely Square - .8 mi •New England Aquarium – 1.2 mi •Boston Opera House - .5 mi •Near Tufts University (6.9 mi), Tufts Medical Center (1.1 mi), and Emerson College (.2 mi)"
994317,Chinatown,"Perfectly located between The Theater District, the Financial District and Boston Common."
8830015,Chinatown,
9183638,Chinatown,"Neighborhoods: The apartment is uniquely located at the intersection of several great Boston neighborhoods: Chinatown, the Theater District, the Leather District and the South End. Many more great neighborhoods are within easy walking distance including Back Bay, Beacon Hill, the Waterfront, the Seaport District and Fort Point.  Some Notable Nearby Locations/Attractions:  -Boston Common and Public Garden -Rose Kennedy Greenway -Charles River Esplanade -South End Open Market (SoWa Sundays) -Newbury Street  -Freedom Trail -South Station Nearby Hospitals: Location is close to many of Boston's major hospitals, which makes it a great place to stay during a rotation or an interview. -Tufts Medical Center (walk: 5 min) -Boston Medical Center (walk: 20 min; bus: 15 min; drive: 5 min) -Massachusetts General Hospital (MGH) (walk: 25 min; subway: 20 min; drive: 10 min)  Nearby Schools and Universities: Location is steps away from the Tufts University Health Sciences campus (5 min walk). The Bosto"
11126122,Chinatown,
21891,Chinatown,
9922595,Chinatown,"Major Attractions: •Restaurants – The Q Restaurant (1 min), Artisan Bistro (.1 mi), My Thai Vegan Café (1 min), Sip Wine Bar and Kitchen (.1 mi) •Faneuil Hall for shopping and dining – .8 mi •Shops at Prudential Center – 2 mi •Downtown Crossing  featuring local events, eclectic nightlife, history and culture – Freedom Trail, over 100 restaurants, and over 500 retailers – .4 mi •Massachusetts Convention Center – 1.1 mi •Copely Square - .8 mi •New England Aquarium – 1.2 mi •Boston Opera House - .5 mi •Near Tufts University (6.9 mi), Tufts Medical Center (1.1 mi), and Emerson College (.2 mi)"
14506396,Chinatown,
721979,Chinatown,"Perfectly located between The Theater District, the Financial District and Boston Common."
10117329,Chinatown,"Major Attractions: •Restaurants – The Q Restaurant (1 min), Artisan Bistro (.1 mi), My Thai Vegan Café (1 min), Sip Wine Bar and Kitchen (.1 mi) •Faneuil Hall for shopping and dining – .8 mi •Shops at Prudential Center – 2 mi •Downtown Crossing  featuring local events, eclectic nightlife, history and culture – Freedom Trail, over 100 restaurants, and over 500 retailers – .4 mi •Massachusetts Convention Center – 1.1 mi •Copely Square - .8 mi •New England Aquarium – 1.2 mi •Boston Opera House - .5 mi •Near Tufts University (6.9 mi), Tufts Medical Center (1.1 mi), and Emerson College (.2 mi)"
218259,Chinatown,
9905304,Chinatown,
11169560,Chinatown,
8861069,Chinatown,
7630346,Chinatown,
13943142,Chinatown,
12302222,Chinatown,"Major Attractions: •Rose Kennedy Greenway – public park featuring contemporary art, water features, modern landscaping, food trucks, and seasonal events – .3 mi •Restaurants – The Townsman – located at the base of the Radian, Shabu-Zen (.2 mi), New Jumbo Seafood (.1 mi), Blu (.3 mi), Artisan Bistro (.3 mi) •Whole Foods for groceries - .6 mi •The Shops at Prudential Center – 1.2 mi •House of Blues – 2 mi •Museum of Fine Arts – 2.2 mi •Prudential Skywalk – highest observation deck in New England -1.3 mi •Historical Freedom Trail walking tour – .6 mi •Faneuil Hall – .6 mi •Fenway Park – 2.3 mi •Boston University (3 mi),  Northeastern University (1.7 mi), and Harvard (4.2 mi) •Boston Children’s Hospital – 2.4 mi"
11410652,Dorchester,
6005290,Dorchester,
1510876,Dorchester,
7693354,Dorchester,"Savin Hill is a beautiful neighborhood with many gorgeous homes and a diverse population.  There is a Red Line T stop very close by which allows very easy access to downtown Boston and Cambridge.  There are several restaurants, a liquor store, a pharmacy, a beauty salon and an ice cream shop nearby.  A large supermarket is one stop away on the T, at the JFK/UMASS stop.  There is a Vietnamese grocery store nearby which has fresh produce and many other staples available.  There are also Vietnamese bakeries which have bread and French baguettes."
1178371,Dorchester,"Dorchester is a diverse and large neighborhood. Our Victorian house is located in the unique Wellesley Park with gas-lit street lights. It's a safe, friendly and beautiful area with a park right in front of the house. Our house is located in a residential area. There are take-out restaurants, grocery stores and a laundromat in walking distance. (10 minutes walking) Nothing as fancy as downtown Boston though, ^^! We're 2 blocks from the Redline T station (Shawmut) so it'll be very easy for you to get to downtown Boston (20min), UMass Boston, MIT or Harvard Sq. (35min) 3 minutes walk to the Subway --- guests will hear the underground rumble occasionally. It won't affect your peaceful stay. (see reviews)"
7292184,Dorchester,
12492474,Dorchester,"Our house is located near Milton Station or Central av station on Red line trolley. You can also take the bus from Ashmount station (only 4 stops) and it will drop you off 5 houses down from our place. There are supermarket, restaurants, ice cream shop, pizza shops, drug store and the library all in walking distance (all in 2 - 5 minutes). There's a beautiful trail that you can walk and get some exercise on."
13578911,Dorchester,
8566407,Dorchester,
7927765,Dorchester,
12904318,Dorchester,
7106162,Dorchester,
